{
  "schema": "lemonpress/manga-style-stack/v0",
  "id": "RENJI_JP_RELAY_COLOR_001",
  "title": "RENJI JP RELAY COLOR 001",
  "styles": [
    {
      "styleId": "RENJI_RELAY_COLOR_001",
      "priority": 10,
      "mode": "global",
      "domainMask": [
        "languageBehavior",
        "textChannels",
        "visualPalette",
        "panelBehavior",
        "tone",
        "worldMotifs"
      ],
      "overrides": {}
    },
    {
      "styleId": "LANGUAGE_THROUGH_MANGA_001",
      "priority": 11,
      "mode": "global",
      "domainMask": [
        "languageBehavior",
        "textChannels",
        "visualPalette",
        "panelBehavior",
        "tone",
        "worldMotifs"
      ],
      "overrides": {}
    },
    {
      "styleId": "HOUSE_WARMTH_001",
      "priority": 12,
      "mode": "global",
      "domainMask": [
        "languageBehavior",
        "textChannels",
        "visualPalette",
        "panelBehavior",
        "tone",
        "worldMotifs"
      ],
      "overrides": {}
    },
    {
      "styleId": "ROOMSTACK_METAPHYSICS_001",
      "priority": 13,
      "mode": "global",
      "domainMask": [
        "languageBehavior",
        "textChannels",
        "visualPalette",
        "panelBehavior",
        "tone",
        "worldMotifs"
      ],
      "overrides": {}
    }
  ],
  "resolutionPolicy": "refuse-conflicts",
  "laws": [
    "STYLE != CONTENT",
    "STYLE != AUTHORITY",
    "STYLE != ADMISSION",
    "COMPOSITION != COLLAPSE",
    "LAYER != REPLACEMENT",
    "PRIMARY != GLOSS",
    "GLOSS != REPLACEMENT",
    "WORLD TEXT != DIALOGUE",
    "STYLE CONFLICT MUST BE RESOLVED EXPLICITLY",
    "SOURCE TRACE MAY SURVIVE",
    "LANGUAGE PASSAGE MAY REMAIN VISIBLE",
    "STACK CHANGE != SAME CANDIDATE"
  ]
}
